keyword,priority,volume,kd,cpc,intent,seed,flag,published,Ссылка конкурента 1,Ссылка конкурента 2,Ссылка конкурента 3,Заголовок конкурента 1,Заголовок конкурента 2,Заголовок конкурента 3,Сниппет конкурента 1,Сниппет конкурента 2,Сниппет конкурента 3
how to use otter ai with zoom,1,90,21,0,I,otter ai,ok,,,,,,,,,,
how to add otter ai to zoom,1,70,21,0,I,otter ai,ok,,,,,,,,,,
how to connect otter ai to zoom,1,30,12,0,I,otter ai,ok,,,,,,,,,,
how to use otter ai to transcribe,1,20,45,1.33,I,otter ai,ok,,,,,,,,,,
how to use otter ai with microsoft teams,1,10,15,0,I,otter ai,ok,,,,,,,,,,
