keyword,priority,volume,kd,cpc,intent,seed,flag,published,Ссылка конкурента 1,Ссылка конкурента 2,Ссылка конкурента 3,Заголовок конкурента 1,Заголовок конкурента 2,Заголовок конкурента 3,Сниппет конкурента 1,Сниппет конкурента 2,Сниппет конкурента 3
google meet transcribe,2,90,14,3.97,I,google meet transcription,ok,,,,,,,,,,
google meeting transcription,2,70,14,4.83,I,google meet transcription,ok,,,,,,,,,,
transcribe google meet,2,70,14,4.07,I,google meet transcription,ok,,,,,,,,,,
how to transcribe google meet,2,50,7,3.72,I,google meet transcription,ok,,,,,,,,,,
google meet live transcription,2,30,14,4.31,I,google meet transcription,ok,,,,,,,,,,
how to get transcript from google meet,2,30,7,3.95,I,google meet transcription,ok,,,,,,,,,,
google meet recording transcript,2,30,14,5.25,I,google meet transcription,ok,,,,,,,,,,
google meet recording and transcription,2,30,14,5.38,I,google meet transcription,ok,,,,,,,,,,
transcript google meet,2,20,14,3.82,I,google meet transcription,ok,,,,,,,,,,
transcription google meet,2,20,14,6.44,I,google meet transcription,ok,,,,,,,,,,
transcript for google meet,2,20,21,4.21,I,google meet transcription,ok,,,,,,,,,,
transcription for google meet,2,20,14,4.21,"I,N",google meet transcription,ok,,,,,,,,,,
google meet captions transcript,2,10,14,0,I,google meet transcription,ok,,,,,,,,,,
transcript of google meet,2,10,14,2.07,I,google meet transcription,ok,,,,,,,,,,
google meet save transcript,2,10,14,0,I,google meet transcription,ok,,,,,,,,,,
google meet transcript,2,10,14,4.33,I,google meet transcription,ok,,,,,,,,,,
how to use google meet transcript,2,10,14,0,I,google meet transcription,ok,,,,,,,,,,
how to record transcript on google meet,2,10,7,4.3,I,google meet transcription,ok,,,,,,,,,,
google meet chat transcript,2,10,15,0,I,google meet transcription,ok,,,,,,,,,,
how to live transcribe google meet calls,2,0,7,0,I,google meet transcription,ok,,,,,,,,,,
google meet transcripts,2,70,7,5.14,I,google meet transcription,ok,,,,,,,,,,
google meet ai transcription,2,70,28,4.49,I,google meet transcription,ok,,,,,,,,,,
google meet transcription free,2,50,27,2.94,I,google meet transcription,ok,,,,,,,,,,
google meet transcription extension,2,30,19,3.15,I,google meet transcription,ok,,,,,,,,,,
google meet transcript extension,2,10,20,2.37,I,google meet transcription,ok,,,,,,,,,,
free google meet transcription,2,10,26,3.81,"I,N",google meet transcription,ok,,,,,,,,,,
how to get transcript of google meet,2,10,14,5.09,I,google meet transcription,ok,,,,,,,,,,
google meet closed captioning transcript,2,10,14,0,I,google meet transcription,ok,,,,,,,,,,
meeting note taker,2,810,33,4.46,I,google meet notes,ok,,,,,,,,,,
ai meeting notes,2,810,54,3.3,I,google meet notes,ok,,,,,,,,,,
take notes for me,2,590,45,2.43,I,google meet notes,ok,,,,,,,,,,
google note taker,2,480,42,1.87,I,google meet notes,ok,,,,,,,,,,
google meet notes taker,2,480,19,4.64,I,google meet notes,ok,,,,,,,,,,
free ai meeting note taker,2,480,40,2.97,I,google meet notes,ok,,,,,,,,,,
best free ai meeting note taker,2,320,44,2.19,I,google meet notes,ok,,,,,,,,,,
meeting minutes ai,2,260,47,3.5,I,google meet notes,ok,,,,,,,,,,
meet transcript,2,260,20,3.12,I,google meet notes,ok,,,,,,,,,,
google meet ai,2,260,33,2.54,I,google meet notes,ok,,,,,,,,,,
ai note taker for google meet,2,210,31,6.45,I,google meet notes,ok,,,,,,,,,,
ai note taker for google meets,2,210,23,6.45,I,google meet notes,ok,,,,,,,,,,
gemini record,2,170,28,2.04,I,google meet notes,ok,,,,,,,,,,
gemini recording,2,170,34,2.04,"L,C",google meet notes,ok,,,,,,,,,,
google meet note,2,170,21,4.44,I,google meet notes,ok,,,,,,,,,,
ai meeting notes free,2,170,41,2.61,I,google meet notes,ok,,,,,,,,,,
ai meeting notetaker,2,170,47,2.98,I,google meet notes,ok,,,,,,,,,,
google meets notetaker,2,170,19,5.7,I,google meet notes,ok,,,,,,,,,,
google meeting notetaker,2,170,22,5.7,I,google meet notes,ok,,,,,,,,,,
google meet notetaker,2,170,19,5.7,I,google meet notes,ok,,,,,,,,,,
google minutes,2,140,22,3,I,google meet notes,ok,,,,,,,,,,
google meeting notes,2,140,13,3.73,I,google meet notes,ok,,,,,,,,,,
transcribe meet,2,140,21,3.82,I,google meet notes,ok,,,,,,,,,,
google meeting ai notes,2,140,27,3.75,I,google meet notes,ok,,,,,,,,,,
google meet ai notes,2,140,27,3.75,I,google meet notes,ok,,,,,,,,,,
google meet ai note,2,140,19,3.75,I,google meet notes,ok,,,,,,,,,,
google meets ai notes,2,140,27,3.75,I,google meet notes,ok,,,,,,,,,,
google meet ai note taking,2,110,19,3.72,I,google meet notes,ok,,,,,,,,,,
ai notetaker for google meet,2,110,26,6.23,I,google meet notes,ok,,,,,,,,,,
ai note taker google meet,2,110,19,4.85,I,google meet notes,ok,,,,,,,,,,
google meet take notes for me,2,110,20,3.07,I,google meet notes,ok,,,,,,,,,,
how to use ai to take meeting notes,2,90,40,2.02,I,google meet notes,ok,,,,,,,,,,
google meet ai summary,2,90,23,3.75,I,google meet notes,ok,,,,,,,,,,
best meeting ai note taker,2,90,32,4.16,I,google meet notes,ok,,,,,,,,,,
google meet ai note taker free,2,90,19,2.05,I,google meet notes,ok,,,,,,,,,,
google meet meeting notes,2,70,17,5.6,I,google meet notes,ok,,,,,,,,,,
automated meeting notes,2,70,50,3.51,I,google meet notes,ok,,,,,,,,,,
google meeting note taker,2,70,19,3.09,I,google meet notes,ok,,,,,,,,,,
google meeting notes taker,2,70,19,3.09,I,google meet notes,ok,,,,,,,,,,
google meet ai meeting notes,2,70,24,4.13,I,google meet notes,ok,,,,,,,,,,
google meeting bot,2,50,19,2.41,I,google meet notes,ok,,,,,,,,,,
live note taking,2,50,58,2.98,I,google meet notes,ok,,,,,,,,,,
google meet note taking,2,50,13,4.55,I,google meet notes,ok,,,,,,,,,,
how to use gemini in google meet,2,50,21,0.53,I,google meet notes,ok,,,,,,,,,,
ai to take meeting notes,2,50,53,3.84,I,google meet notes,ok,,,,,,,,,,
free ai note taker for google meet,2,50,19,4.25,I,google meet notes,ok,,,,,,,,,,
google meet ai notetaker,2,50,22,6.4,I,google meet notes,ok,,,,,,,,,,
google meet note taker ai,2,50,19,3.41,I,google meet notes,ok,,,,,,,,,,
notetaker for google meet,2,50,19,6.55,I,google meet notes,ok,,,,,,,,,,
note taker for google meet,2,40,26,5.58,I,google meet notes,ok,,,,,,,,,,
google meeting notes ai,2,40,25,2.32,I,google meet notes,ok,,,,,,,,,,
notetaker google meet,2,40,19,4.5,I,google meet notes,ok,,,,,,,,,,
take notes for me google meet,2,40,13,3.68,I,google meet notes,ok,,,,,,,,,,
gemini meeting,2,40,28,1.82,I,google meet notes,ok,,,,,,,,,,
google meeting minutes,2,30,14,2.96,I,google meet notes,ok,,,,,,,,,,
google minutes of meeting,2,30,24,2.96,I,google meet notes,ok,,,,,,,,,,
meeting notetaker,2,30,52,4.46,I,google meet notes,ok,,,,,,,,,,
note taking google drive,2,30,22,0,I,google meet notes,ok,,,,,,,,,,
ai google meet note taker,2,30,25,5.15,I,google meet notes,ok,,,,,,,,,,
ai note taking for google meet,2,30,25,3.97,I,google meet notes,ok,,,,,,,,,,
google meet ai assistant,2,30,39,5.02,I,google meet notes,ok,,,,,,,,,,
google meet take notes,2,30,30,3.74,I,google meet notes,ok,,,,,,,,,,
meeting notes ai,2,20,56,3.88,I,google meet notes,ok,,,,,,,,,,
meet notes,2,20,41,3.2,"I,N",google meet notes,ok,,,,,,,,,,
note taker google meet,2,20,23,7.17,I,google meet notes,ok,,,,,,,,,,
ai meeting note taker google meet,2,20,27,3.14,I,google meet notes,ok,,,,,,,,,,
ai notetaker google meet,2,20,34,3.87,I,google meet notes,ok,,,,,,,,,,
ai note taker for google meet free,2,20,24,3.61,I,google meet notes,ok,,,,,,,,,,
ai note taking google meet,2,20,24,9.26,I,google meet notes,ok,,,,,,,,,,
ai notes for google meet,2,20,39,1.76,I,google meet notes,ok,,,,,,,,,,
ai notes google meet,2,20,35,6.83,I,google meet notes,ok,,,,,,,,,,
free google meet ai note taker,2,20,21,4.49,I,google meet notes,ok,,,,,,,,,,
google meet note taker free,2,20,19,2.22,I,google meet notes,ok,,,,,,,,,,
google meet summary ai,2,20,41,2.76,I,google meet notes,ok,,,,,,,,,,
notetaker in google meet,2,20,20,3.56,I,google meet notes,ok,,,,,,,,,,
google meet ai recording,2,20,32,5.54,I,google meet notes,ok,,,,,,,,,,
ai meeting assistant for google meet,2,20,27,0,I,google meet notes,ok,,,,,,,,,,
free google meet note taker,2,20,21,2.21,I,google meet notes,ok,,,,,,,,,,
google take notes online,2,10,54,0,"I,N",google meet notes,ok,,,,,,,,,,
google taker,2,10,49,0,"I,N",google meet notes,ok,,,,,,,,,,
google ote,2,10,47,0,"I,N",google meet notes,ok,,,,,,,,,,
virtual meeting notes,2,10,60,1.31,I,google meet notes,ok,,,,,,,,,,
tools for google meet,2,10,31,0,"I,N",google meet notes,ok,,,,,,,,,,
tool google meet,2,10,40,0,"I,N",google meet notes,ok,,,,,,,,,,
google meet patch notes,2,10,18,0,"I,N",google meet notes,ok,,,,,,,,,,
meeting notes google calendar,2,10,19,0,I,google meet notes,ok,,,,,,,,,,
note taker meeting,2,10,67,3.46,"I,N",google meet notes,ok,,,,,,,,,,
google meet assistant,2,10,18,5.48,I,google meet notes,ok,,,,,,,,,,
google take a note for me,2,10,36,2.44,I,google meet notes,ok,,,,,,,,,,
meeting notes in google calendar,2,10,20,0,I,google meet notes,ok,,,,,,,,,,
note taker in a meeting,2,10,22,0,I,google meet notes,ok,,,,,,,,,,
meeting notes google,2,10,25,2.06,I,google meet notes,ok,,,,,,,,,,
google calendar meeting minutes,2,10,20,0,I,google meet notes,ok,,,,,,,,,,
meeting minutes google,2,10,16,0,I,google meet notes,ok,,,,,,,,,,
meeting notes for google meet,2,10,12,0,I,google meet notes,ok,,,,,,,,,,
take notes with google,2,10,36,0,"I,N",google meet notes,ok,,,,,,,,,,
take notes on google,2,10,43,0,I,google meet notes,ok,,,,,,,,,,
ai call notes,2,10,70,3.16,"I,N",google meet notes,ok,,,,,,,,,,
google meet note taker,2,480,0,4.64,I,google meet notes,ok,,,,,,,,,,
google docs meeting notes template,2,260,10,1.46,I,google meet notes,ok,,,,,,,,,,
meeting notes template google docs,2,210,10,1.6,I,google meet notes,ok,,,,,,,,,,
google doc meeting notes template,2,70,7,1.35,I,google meet notes,ok,,,,,,,,,,
google docs meeting notes,2,50,16,0,I,google meet notes,ok,,,,,,,,,,
google calendar meeting notes,2,40,17,0,I,google meet notes,ok,,,,,,,,,,
google meeting notes template,2,20,19,2,I,google meet notes,ok,,,,,,,,,,
google meet release notes,2,10,25,0,"I,N",google meet notes,ok,,,,,,,,,,
meeting notes google doc template,2,10,19,0,"I,N",google meet notes,ok,,,,,,,,,,
google calendar meeting notes recurring,2,10,16,0,I,google meet notes,ok,,,,,,,,,,
google meet ai note taker,2,10,22,4.37,I,google meet notes,ok,,,,,,,,,,
google meets ai note taker,2,10,23,4.37,I,google meet notes,ok,,,,,,,,,,
take notes in google meet,2,10,17,5.09,I,google meet notes,ok,,,,,,,,,,
google meeting ai note taker,2,10,25,4.37,I,google meet notes,ok,,,,,,,,,,
how to create google meet notes,2,0,16,0,I,google meet notes,ok,,,,,,,,,,
how create google meet notes,2,0,16,0,I,google meet notes,ok,,,,,,,,,,
ai note taker,2,27100,87,3.12,I,ai note taker google meet,ok,,,,,,,,,,
note taker,2,14800,92,1.63,I,ai note taker google meet,ok,,,,,,,,,,
ai note taking,2,14800,90,3.12,I,ai note taker google meet,ok,,,,,,,,,,
meeting assistant,2,3600,71,4.21,I,ai note taker google meet,ok,,,,,,,,,,
ai meeting note taker,2,3200,72,4.3,I,ai note taker google meet,ok,,,,,,,,,,
ai meeting assistant,2,2900,69,4.04,I,ai note taker google meet,ok,,,,,,,,,,
ai note-taking,2,2400,71,3.12,I,ai note taker google meet,ok,,,,,,,,,,
ai notetaker,2,2400,74,3.2,I,ai note taker google meet,ok,,,,,,,,,,
ai meeting,2,1900,66,2.84,I,ai note taker google meet,ok,,,,,,,,,,
meeting ai,2,1900,63,2.84,I,ai note taker google meet,ok,,,,,,,,,,
notetaker,2,1800,71,2.59,I,ai note taker google meet,ok,,,,,,,,,,
note taking ai,2,1600,69,3.03,I,ai note taker google meet,ok,,,,,,,,,,
note taker ai,2,1300,71,2.94,I,ai note taker google meet,ok,,,,,,,,,,
free ai note taker,2,740,44,2.42,I,ai note taker google meet,ok,,,,,,,,,,
take meeting notes,2,660,44,3.3,I,ai note taker google meet,ok,,,,,,,,,,
meeting minutes recorder,2,480,44,3.19,I,ai note taker google meet,ok,,,,,,,,,,
meeting note taker app,2,480,49,3.72,I,ai note taker google meet,ok,,,,,,,,,,
record meeting notes,2,480,42,3.19,I,ai note taker google meet,ok,,,,,,,,,,
meeting note taking app,2,480,37,3.72,I,ai note taker google meet,ok,,,,,,,,,,
recording meeting notes,2,480,41,3.19,I,ai note taker google meet,ok,,,,,,,,,,
ai meeting recorder,2,480,40,3.17,I,ai note taker google meet,ok,,,,,,,,,,
note takers,2,440,61,1.63,I,ai note taker google meet,ok,,,,,,,,,,
automatic note taker,2,390,47,2.88,I,ai note taker google meet,ok,,,,,,,,,,
auto note taker,2,390,52,2.88,I,ai note taker google meet,ok,,,,,,,,,,
ai note taker for in person meetings,2,390,45,3.54,I,ai note taker google meet,ok,,,,,,,,,,
note taker free,2,390,46,1.64,I,ai note taker google meet,ok,,,,,,,,,,
ai note taking tools,2,360,53,3.7,I,ai note taker google meet,ok,,,,,,,,,,
ai notes taker,2,320,44,3.12,I,ai note taker google meet,ok,,,,,,,,,,
ai meeting note taker free,2,320,42,3.28,I,ai note taker google meet,ok,,,,,,,,,,
free ai notetaker,2,320,44,2.85,I,ai note taker google meet,ok,,,,,,,,,,
meeting ai note taker,2,320,49,4.13,I,ai note taker google meet,ok,,,,,,,,,,
ai meeting transcription,2,260,56,3.58,I,ai note taker google meet,ok,,,,,,,,,,
ai meeting transcript,2,260,62,3.58,I,ai note taker google meet,ok,,,,,,,,,,
ai note taker for meetings,2,260,46,4.73,I,ai note taker google meet,ok,,,,,,,,,,
meeting note taking,2,250,43,3.3,I,ai note taker google meet,ok,,,,,,,,,,
note taker for meetings,2,210,53,3.47,I,ai note taker google meet,ok,,,,,,,,,,
ai for meeting minutes,2,210,41,2.99,I,ai note taker google meet,ok,,,,,,,,,,
ai meeting summary,2,210,37,3.37,I,ai note taker google meet,ok,,,,,,,,,,
ai that listens and takes notes,2,210,54,4.21,I,ai note taker google meet,ok,,,,,,,,,,
meet transcribe,2,210,27,4.02,I,ai note taker google meet,ok,,,,,,,,,,
meeting note taker ai,2,210,56,3.97,I,ai note taker google meet,ok,,,,,,,,,,
meeting note taking ai,2,210,56,3.97,I,ai note taker google meet,ok,,,,,,,,,,
ai for note taking,2,210,46,2.82,I,ai note taker google meet,ok,,,,,,,,,,
ai note taking for meetings,2,210,45,4.14,I,ai note taker google meet,ok,,,,,,,,,,
meeting notes software,2,190,41,5.16,I,ai note taker google meet,ok,,,,,,,,,,
google meet notes,2,170,13,4.44,I,ai note taker google meet,ok,,,,,,,,,,
best app for meeting notes,2,170,20,3.49,I,ai note taker google meet,ok,,,,,,,,,,
minutes taker,2,170,41,2.66,I,ai note taker google meet,ok,,,,,,,,,,
ai tools for meeting notes,2,170,45,3.21,I,ai note taker google meet,ok,,,,,,,,,,
ai note taking software,2,170,43,3.19,I,ai note taker google meet,ok,,,,,,,,,,
ai notetaker app,2,170,42,3.01,I,ai note taker google meet,ok,,,,,,,,,,
ai for meeting notes,2,170,57,3.85,I,ai note taker google meet,ok,,,,,,,,,,
note taker ai free,2,170,36,2.84,I,ai note taker google meet,ok,,,,,,,,,,
video note taker ai,2,170,31,1.44,I,ai note taker google meet,ok,,,,,,,,,,
meeting note taking software,2,140,52,3.22,I,ai note taker google meet,ok,,,,,,,,,,
ai for meetings,2,140,60,4.17,I,ai note taker google meet,ok,,,,,,,,,,
meeting summary ai,2,140,34,3.59,I,ai note taker google meet,ok,,,,,,,,,,
note taking ai free,2,140,42,1.9,I,ai note taker google meet,ok,,,,,,,,,,
ai notetaker free,2,140,49,2.89,I,ai note taker google meet,ok,,,,,,,,,,
meeting transcription ai,2,140,62,4.25,I,ai note taker google meet,ok,,,,,,,,,,
ai that takes notes for you,2,140,61,3.46,I,ai note taker google meet,ok,,,,,,,,,,
app minute taker,2,110,29,3.37,I,ai note taker google meet,ok,,,,,,,,,,
ai minutes of meeting,2,110,54,2.74,I,ai note taker google meet,ok,,,,,,,,,,
ai minute,2,110,37,3.03,I,ai note taker google meet,ok,,,,,,,,,,
ai minutes,2,110,45,3.03,I,ai note taker google meet,ok,,,,,,,,,,
ai meeting tool,2,110,62,5.34,I,ai note taker google meet,ok,,,,,,,,,,
ai meeting tools,2,110,59,5.34,I,ai note taker google meet,ok,,,,,,,,,,
ai note taking free,2,110,43,2.86,I,ai note taker google meet,ok,,,,,,,,,,
ai powered note taking,2,110,47,2.11,I,ai note taker google meet,ok,,,,,,,,,,
free meeting recorder app,2,90,27,2.37,I,ai note taker google meet,ok,,,,,,,,,,
google notes on the journey,2,0,18,0,I,google meet meeting notes,ok,,,,,,,,,,
ai meeting summary for google meet,2,0,46,0,I,google meet meeting notes,ok,,,,,,,,,,
ai notetaker chrome extension,2,0,38,0,I,google meet meeting notes,ok,,,,,,,,,,
google calendar meeting capture,2,0,14,0,I,google meet meeting notes,ok,,,,,,,,,,
transcript meet,2,260,7,3.12,I,transcribe google meet,ok,,,,,,,,,,
google meets transcribe,2,90,7,3.97,I,transcribe google meet,ok,,,,,,,,,,
transcript google extension,2,40,18,2.22,I,transcribe google meet,ok,,,,,,,,,,
meet transcript chrome extension,2,40,27,2.57,I,transcribe google meet,ok,,,,,,,,,,
transcribe google meet recording,2,20,7,5.28,I,transcribe google meet,ok,,,,,,,,,,
google automatic transcription,2,10,43,0,"I,N",transcribe google meet,ok,,,,,,,,,,
google auto transcribe,2,10,39,1.49,"I,N",transcribe google meet,ok,,,,,,,,,,
automatic transcription google,2,10,43,0,"I,N",transcribe google meet,ok,,,,,,,,,,
conference call recording transcription,2,10,13,0,I,transcribe google meet,ok,,,,,,,,,,
google meet real time,2,10,50,0,"I,N",transcribe google meet,ok,,,,,,,,,,
google meet captions save,2,10,15,0,I,transcribe google meet,ok,,,,,,,,,,
google meet record captions,2,10,20,0,I,transcribe google meet,ok,,,,,,,,,,
google meet save,2,10,14,0,I,transcribe google meet,ok,,,,,,,,,,
google meet download captions,2,10,14,0,I,transcribe google meet,ok,,,,,,,,,,
google meet audio extension,2,10,11,0,I,transcribe google meet,ok,,,,,,,,,,
google live transcribe phone calls,2,10,27,0,"I,N",transcribe google meet,ok,,,,,,,,,,
meet transcription extension,2,10,27,0,I,transcribe google meet,ok,,,,,,,,,,
meet transcript extension,2,10,20,0,I,transcribe google meet,ok,,,,,,,,,,
transcribe video meeting,2,10,58,0,"I,N",transcribe google meet,ok,,,,,,,,,,
google for transcribe,2,0,42,0,I,transcribe google meet,ok,,,,,,,,,,
how to transcribe google meet calls,2,0,7,0,I,transcribe google meet,ok,,,,,,,,,,
record google,2,8000,76,0.89,"I,N",google meet recorder,ok,,,,,,,,,,
google meet recording,2,2400,75,2.01,I,google meet recorder,ok,,,,,,,,,,
record a meeting,2,1800,71,3.59,I,google meet recorder,ok,,,,,,,,,,
record google meet,2,1300,72,3.7,I,google meet recorder,ok,,,,,,,,,,
record meeting,2,610,40,3.59,I,google meet recorder,ok,,,,,,,,,,
how to record google meet,2,590,14,1.33,I,google meet recorder,ok,,,,,,,,,,
how to record in google meet,2,590,14,0.68,I,google meet recorder,ok,,,,,,,,,,
where to find google meet recordings,2,590,7,0,I,google meet recorder,ok,,,,,,,,,,
meet recording,2,590,14,3.06,I,google meet recorder,ok,,,,,,,,,,
meet recordings,2,590,14,3.06,I,google meet recorder,ok,,,,,,,,,,
can i record a google meet,2,390,10,0.79,I,google meet recorder,ok,,,,,,,,,,
how to record a meeting,2,390,17,1.86,I,google meet recorder,ok,,,,,,,,,,
can google meet be recorded,2,320,11,0.2,I,google meet recorder,ok,,,,,,,,,,
record on google meet,2,320,10,1.94,I,google meet recorder,ok,,,,,,,,,,
record a google meet,2,320,10,3.08,I,google meet recorder,ok,,,,,,,,,,
how to find google meet recordings,2,320,7,0,I,google meet recorder,ok,,,,,,,,,,
google meet meeting recording,2,320,14,7.2,I,google meet recorder,ok,,,,,,,,,,
where does my google meet recording go,2,320,6,0,I,google meet recorder,ok,,,,,,,,,,
google meet meeting recorder,2,320,15,7.2,I,google meet recorder,ok,,,,,,,,,,
where do my google meet recordings go,2,320,6,0,I,google meet recorder,ok,,,,,,,,,,
record google video,2,320,31,1.14,I,google meet recorder,ok,,,,,,,,,,
google meet screen recording,2,260,9,2.63,I,google meet recorder,ok,,,,,,,,,,
how to record a google meet call,2,260,12,1.3,I,google meet recorder,ok,,,,,,,,,,
where does google meet save recordings,2,260,6,0,I,google meet recorder,ok,,,,,,,,,,
how to access google meet recordings,2,260,7,0,I,google meet recorder,ok,,,,,,,,,,
where is my google meet recording,2,260,7,0,I,google meet recorder,ok,,,,,,,,,,
google meet screen recorder,2,260,14,2.63,I,google meet recorder,ok,,,,,,,,,,
google meeting recording,2,210,10,4.61,I,google meet recorder,ok,,,,,,,,,,
google meetings record,2,210,10,4.61,I,google meet recorder,ok,,,,,,,,,,
how to record meeting in google meet,2,210,14,3.25,I,google meet recorder,ok,,,,,,,,,,
google meet record meeting,2,210,14,2.18,I,google meet recorder,ok,,,,,,,,,,
can i record google meet,2,210,14,0.87,I,google meet recorder,ok,,,,,,,,,,
how to record google meet call,2,210,19,3.65,I,google meet recorder,ok,,,,,,,,,,
can you record in google meet,2,210,14,0.21,I,google meet recorder,ok,,,,,,,,,,
how do i record a google meet,2,210,14,1.11,I,google meet recorder,ok,,,,,,,,,,
google meet recording feature,2,210,10,1.29,I,google meet recorder,ok,,,,,,,,,,
google meeting recorder,2,210,22,4.61,I,google meet recorder,ok,,,,,,,,,,
does google meet record,2,210,6,0.47,I,google meet recorder,ok,,,,,,,,,,
google meeting extension,2,170,14,4.51,I,google meet recorder,ok,,,,,,,,,,
google meeting video recording,2,170,10,1.84,I,google meet recorder,ok,,,,,,,,,,
how to record google meet on phone,2,170,7,1.21,I,google meet recorder,ok,,,,,,,,,,
how to record a meeting in google meet,2,170,12,1.57,I,google meet recorder,ok,,,,,,,,,,
recording in google meet,2,170,10,1.07,I,google meet recorder,ok,,,,,,,,,,
how to record google meet meeting,2,170,15,4,I,google meet recorder,ok,,,,,,,,,,
how to record meeting on google meet,2,170,14,1.4,I,google meet recorder,ok,,,,,,,,,,
google meet video recording,2,170,14,1.84,I,google meet recorder,ok,,,,,,,,,,
how to screen record on google meet,2,170,10,0.83,I,google meet recorder,ok,,,,,,,,,,
how do you record a google meet,2,170,14,0.74,I,google meet recorder,ok,,,,,,,,,,
can i record on google meet,2,170,14,1.16,I,google meet recorder,ok,,,,,,,,,,
recorder in google meet,2,170,14,1.07,I,google meet recorder,ok,,,,,,,,,,
can you record google meet calls,2,170,12,1.22,I,google meet recorder,ok,,,,,,,,,,
meet audio recorder,2,170,26,1.22,I,google meet recorder,ok,,,,,,,,,,
recording unavailable google meet,2,170,7,0,I,google meet recorder,ok,,,,,,,,,,
how to record a google meeting,2,140,11,2.94,I,google meet recorder,ok,,,,,,,,,,
how to record a meeting on google meet,2,140,10,1.24,I,google meet recorder,ok,,,,,,,,,,
google meeting how to record,2,140,15,0.84,I,google meet recorder,ok,,,,,,,,,,
google meet how to record,2,140,15,0.84,I,google meet recorder,ok,,,,,,,,,,
record google meet call,2,140,12,4.19,I,google meet recorder,ok,,,,,,,,,,
are google meets recorded,2,140,7,0,I,google meet recorder,ok,,,,,,,,,,
how to record a google meet meeting,2,140,14,4.61,I,google meet recorder,ok,,,,,,,,,,
where do recorded google meets go,2,140,6,0.03,I,google meet recorder,ok,,,,,,,,,,
can you record meetings on google meet,2,140,12,0.78,I,google meet recorder,ok,,,,,,,,,,
where can i find my google meet recordings,2,140,7,0,I,google meet recorder,ok,,,,,,,,,,
google meet video call recording,2,140,14,0,I,google meet recorder,ok,,,,,,,,,,
record conference calls,2,110,5,2.96,I,google meet recorder,ok,,,,,,,,,,
screen record google meet,2,110,10,2.58,I,google meet recorder,ok,,,,,,,,,,
screen recorder for google meet,2,110,23,3.24,I,google meet recorder,ok,,,,,,,,,,
record google meet video,2,110,14,1.82,I,google meet recorder,ok,,,,,,,,,,
how do you record on google meet,2,110,14,0.61,I,google meet recorder,ok,,,,,,,,,,
screen recorder google meet,2,110,23,2.58,I,google meet recorder,ok,,,,,,,,,,
where do i find google meet recordings,2,110,7,0,I,google meet recorder,ok,,,,,,,,,,
does google meet automatically record,2,110,14,0,I,google meet recorder,ok,,,,,,,,,,
video meeting recording,2,90,35,3.53,I,google meet recorder,ok,,,,,,,,,,
record meeting google meet,2,90,7,4.9,I,google meet recorder,ok,,,,,,,,,,
this meeting is being recorded,2,90,25,0,I,google meet recorder,ok,,,,,,,,,,
how to screen record google meet,2,90,10,1.4,I,google meet recorder,ok,,,,,,,,,,
can google meet record,2,90,7,0.73,I,google meet recorder,ok,,,,,,,,,,
how to record google meet for free,2,90,14,3.4,I,google meet recorder,ok,,,,,,,,,,
where can i find google meet recordings,2,90,7,0,I,google meet recorder,ok,,,,,,,,,,
can you record a meeting on google meet,2,90,12,1.66,I,google meet recorder,ok,,,,,,,,,,
where does the google meet recording go,2,90,6,0,I,google meet recorder,ok,,,,,,,,,,
how do i record on google meet,2,90,14,0.95,I,google meet recorder,ok,,,,,,,,,,
can you record google meet meetings,2,90,15,1.14,I,google meet recorder,ok,,,,,,,,,,
where do the google meet recordings go,2,90,6,0,I,google meet recorder,ok,,,,,,,,,,
can you screen record on google meet,2,90,10,0.79,I,google meet recorder,ok,,,,,,,,,,
google meet record,2,90,10,2.01,I,google meet recorder,ok,,,,,,,,,,
how to record google meet on laptop,2,90,11,1.83,I,google meet recorder,ok,,,,,,,,,,
can you record a google meet call,2,90,12,1.3,I,google meet recorder,ok,,,,,,,,,,
recording meeting google meet,2,90,7,4.9,I,google meet recorder,ok,,,,,,,,,,
google meets recorder,2,90,14,2.63,I,google meet recorder,ok,,,,,,,,,,
recording video conferencing,2,90,21,3.53,I,google meet recorder,ok,,,,,,,,,,
recording a google hangout,2,70,9,3.91,I,google meet recorder,ok,,,,,,,,,,
how to record google hangout,2,70,9,0,I,google meet recorder,ok,,,,,,,,,,
record online meeting,2,70,27,3.52,I,google meet recorder,ok,,,,,,,,,,
record online meetings,2,70,27,3.52,I,google meet recorder,ok,,,,,,,,,,
google meet recording extension,2,70,11,4.05,I,google meet recorder,ok,,,,,,,,,,
record google hangout,2,70,9,3.91,I,google meet recorder,ok,,,,,,,,,,
