keyword,priority,volume,kd,cpc,intent,seed,flag,published,Ссылка конкурента 1,Ссылка конкурента 2,Ссылка конкурента 3,Заголовок конкурента 1,Заголовок конкурента 2,Заголовок конкурента 3,Сниппет конкурента 1,Сниппет конкурента 2,Сниппет конкурента 3
online meeting recorder,2,70,34,3.52,I,google meet recorder,ok,,,,,,,,,,
google meet recording option,2,70,7,2.05,I,google meet recorder,ok,,,,,,,,,,
google meet record video,2,70,14,2.53,I,google meet recorder,ok,,,,,,,,,,
where are google meet recordings saved,2,390,0,0,I,google meet recorder,ok,,,,,,,,,,
google meet recording location,2,210,6,0,I,google meet recorder,ok,,,,,,,,,,
where do i find my google meet recordings,2,170,7,0,I,google meet recorder,ok,,,,,,,,,,
google meet video recorder,2,170,0,1.84,I,google meet recorder,ok,,,,,,,,,,
google meet recording not showing up,2,110,7,0,I,google meet recorder,ok,,,,,,,,,,
find google meet recordings,2,110,7,0,I,google meet recorder,ok,,,,,,,,,,
record google meet meeting,2,70,10,5.17,I,google meet recorder,ok,,,,,,,,,,
how to record with google meet,2,70,14,0.92,I,google meet recorder,ok,,,,,,,,,,
where is google meet recording saved,2,70,6,0,I,google meet recorder,ok,,,,,,,,,,
how to get google meet recording,2,70,7,0,I,google meet recorder,ok,,,,,,,,,,
can you screen record google meet,2,70,10,0,I,google meet recorder,ok,,,,,,,,,,
how to record a google meet video call,2,70,14,1.75,I,google meet recorder,ok,,,,,,,,,,
can you record with google meet,2,70,12,0.89,I,google meet recorder,ok,,,,,,,,,,
how can i record a google meet,2,70,14,1.75,I,google meet recorder,ok,,,,,,,,,,
google meet recording software,2,70,14,4.75,I,google meet recorder,ok,,,,,,,,,,
record google meet extension,2,70,11,2.3,I,google meet recorder,ok,,,,,,,,,,
google meet recorder extension,2,70,11,4.05,I,google meet recorder,ok,,,,,,,,,,
google meet auto recording,2,70,14,7.09,I,google meet recorder,ok,,,,,,,,,,
can you record google meet for free,2,70,14,0.87,I,google meet recorder,ok,,,,,,,,,,
meet google assistant,2,10,53,0,"I,N",google meet ai notes,ok,,,,,,,,,,
note this google,2,10,49,0,"I,N",google meet ai notes,ok,,,,,,,,,,
auto google meet,2,10,15,0,I,google meet ai notes,ok,,,,,,,,,,
google meet auto,2,10,15,0,I,google meet ai notes,ok,,,,,,,,,,
